AppID,Timestamp Created,UserID,Language,PlayTimeTotal,ReviewID,Purchase,Recommended,ReviewText
2780710,1744836482,76561199083558395,latam,529,192895674,true,true,"Análisis de un juego tipo Vampire Survivors que busca sentirse fresco

Aspectos negativos:

-Animaciones poco coherentes y toscas: Las animaciones de armas, hechizos y habilidades carecen de fluidez y peso. No transmiten impacto ni satisfacción visual, lo que reduce la inmersión y el disfrute durante el combate.

-Sistema de runas ineficaz: El sistema de runas resulta completamente innecesario y poco funcional. Sería mejor eliminarlo por completo y permitir que el jugador simplemente aumente las estadísticas que prefiera, sin complicaciones arbitrarias.

-Mejoras inconsistentes y dependientes del RNG: Las mejoras son poco satisfactorias y no siguen una lógica clara. El sistema aleatorio hace que las mejoras otorguen buffs incoherentes y desbalanceados, como aumentar solo el radio, la cantidad o el tiempo de enfriamiento, sin mejorar realmente el arma o hechizo de forma integral. Lo ideal sería que cada mejora ofreciera múltiples beneficios combinados, adaptados al estilo de cada arma, para que el progreso sea significativo y controlado.

-Progresión de personajes deficiente: Subir de nivel es frustrante porque las mejoras que se pueden elegir son poco impactantes y no se reflejan claramente durante la partida. Además, el sistema actual limita la posibilidad de maximizar las armas, ya que no se pueden mejorar completamente en una sola run, lo que hace que los numerosos niveles disponibles pierdan sentido.

-Música poco destacable y repetitiva: La banda sonora no aporta nada memorable y se vuelve monótona rápidamente. Sería recomendable renovar la música para mejorar la atmósfera y la experiencia general.

Aspectos positivos:

-Personajes interesantes y con ramas de mejora: Aunque está en early access, el juego ya ofrece tres personajes con sus propias líneas de mejora, lo cual es un acierto que aporta variedad y profundidad estratégica.

-Jefes desafiantes y bien diseñados: Los jefes son entretenidos y presentan un nivel de dificultad adecuado, además de contar con un diseño visual impresionante que muchos juegos similares envidiarían.

-Controles excelentes: El manejo del personaje es muy cómodo y responde perfectamente, lo que hace que la experiencia de juego sea fluida y satisfactoria.

-Ritmo y duración adecuados: La duración y el ritmo de las partidas están bien equilibrados, lo que permite disfrutar sin que se sienta ni demasiado corto ni excesivamente largo, a pesar de los problemas mencionados."
2780710,1744248317,76561199248151145,latam,446,192400985,true,true,"Lit the first survivor I found fun 👍"
