Timestamp Created,PlayTimeTotal,TranslatedReview
1745323274,372," Gut gemacht. Es gibt noch nicht viel zu genießen, aber es gibt genug Charme, um Sie zu halten Pluging weg für 4 Stunden.
Die einzigartigen Knotenpunkte sind mächtig, so dass es erfrischend ist, einige ungewöhnliche Eingaben zu sehen, die nicht nur mit der Fähigkeit oder passiven Zahlen skalieren.

Es gibt ein gutes Heilungssystem, aber die Mobs können in Echtzeit stärker werden, wenn dein Schaden nicht gut genug ist, also musst du ein wenig vorsichtig sein.
Allerdings sind die Wiederholungskosten sehr günstig, so dass ich pro Levelaufstieg 2-3 Mal kostenlos wiederholen kann.
Es ist ein Spiel mit vielen Fähigkeiten und passiven Optionen, so dass es einfach ist, Ihren Charakter in die gewünschte Richtung zu entwickeln.

Das einzige, was ich bedauere, ist der Umfang des Spiels.
Ich habe es etwa 6 Stunden lang genossen, aber ich habe alle Charaktere freigeschaltet und den Rest der Materialien gefarmt, um die Glyphen freizuschalten.
Dennoch gab es einige Dinge, die ich freischalten wollte.

Die allererste Verbesserung, Riesenzahn + Wirbelhieb = Klinge des brennenden Chaos.
Am meisten Spaß machte der Knotenpunkt, der vollen Schaden verursachte, sobald der Punktstatus auf diese Fertigkeit angewendet wurde.

Er war billig genug, dass man ihn kaufen, eine Weile damit spielen und ihn dann später ausprobieren konnte.

"
1744938546,825,"Beschissenes Spiel. Ich spiele dieses Spiel nun schon eine Weile und es war großartig. Die Symptome und Fehlermeldungen sind immer noch dieselben. Ich weiß nicht, was sich gegenüber der Demo geändert hat. Sie haben einen neuen Charakter hinzugefügt? Es ist nur ein Haufen Schnickschnack, aber es ist Müll."
1744709634,1144,Fehler bei der Würdigkeit behoben
1744658876,459,"Ich denke, das ist das Beste, was seit dem Buch der Schlangen auf den Markt gekommen ist.

Ich freue mich darauf, es fertig zu sehen."
1744621751,1600,"Das Spiel macht Spaß, aber es gibt zu wenig Inhalt und zu viele unfertige Elemente.

-----------------------------------------------------------------------------------------------------------------------------------

1. mangelhafte Unterstützung für Koreanisch. Die Übersetzung ist auf dem Niveau von Google Translate, einige Teile sind nicht übersetzt und es gibt Kästchen ohne jeglichen Text. (Wechseln Sie zu Englisch und Sie werden es sehen)

2. es gibt keine Erklärungen, wie z.B. ein Tutorial am Anfang.

3. Boss-spezifische Pahwe-Gimmicks sind unklar (keine Hinweise, Sterben durch Blitz in Barnheim)

4. die Balance ist schrecklich. Die Grundangriffe aller 3 Charaktere sind physisch, wenn man also ein Deck mit anderen Klassen bauen will, muss man die Grundangriffe weglassen, aber man kann sie bei der Wahl des Levelaufstiegs nicht ausschließen, also spielt man mit Fesseln. Wenn man sich jedoch für Beschwörung, Fernkampf und andere Unterklassen entscheidet, ist man immer noch im Nachteil, weil der zusätzliche Schadenseffekt von ""Thread"" nur in der Hauptattributklasse verfügbar ist.

5. unfreundliche Grafik Die Grafik besteht aus Punkten, und es gibt keinerlei Text für die Kombinationen, die das Spiel unterstützt. Es ist nur ein vergrößertes Bild eines winzigen Punktes, ohne Namen für die Fähigkeiten, und man kann die Kombinationen während des Spiels nicht sehen.

Der Platz im Inventar ist zu klein, und die Stufen der ""Face Makeover""-Glyphen basieren nur auf der Anzahl der Effekte, die weiter in T1, T2 und T3 unterteilt sind, aber selbst die Glyphen der höchsten Stufe haben alle vier T1-Effekte, so dass die Glyphe der niedrigsten Stufe mit einem einzigen T3-Effekt effektiver sein kann, und die Sichtbarkeit der Stufen, Icons und UI der Gegenstände im Spiel ist schrecklich.

7. es ist ungefähr so ausgefeilt wie eine ""offene Beta"". Wenn Asgards ""Fall - Viking Survivors"" so ""unfertig"" ist, dass ein zufälliger Beobachter denken würde, dass es mindestens ein Jahr an Zeit, Geld, Entwicklung und Planung benötigt, um es fertigzustellen, dann ist es ""unfertig"".

Ehrlich gesagt, wenn es eine kostenlose DEMO-Version wäre, würde ich die Qualität des Spiels loben, aber wenn es eine kostenpflichtige Version ist, würde ich Ihnen raten, zweimal über den Kauf nachzudenken."
1744563567,1434,"Es sind erst 4 der 9 Karten erschienen, und es gibt so viele verschiedene Builds... Ich kann mit dem Build, den ich will, nicht alles machen, was ich will, aber es macht trotzdem Spaß.
Es gibt viele fehlende Übersetzungen, und es gibt kein separates Tutorial, so dass es ein wenig ärgerlich war, alle Funktionen nacheinander ausprobieren zu müssen, aber es gibt keine Schwierigkeiten beim Zugang zum Spiel.


Die Runeneinstellungen sind einmal offen!!!! Bitte fügen Sie eine Taste zum Reinigen von Runenstapeln zum Inventar hinzu!!! Der Platz im Inventar ist auch sehr klein, was schade ist!!! Fügen Sie eine Voreinstellungsfunktion hinzu!!! Wenn ich mich wieder verbinde, wechselt es zurück zu einem Krieger, obwohl ich es mit einem anderen Charakter gemacht habe.

Ja, ansonsten ist alles gut...


Notizblock ㅡ
Maximale Fluggeschwindigkeit: 500
Max. Ausweichen: 33
Max. Fluggeschwindigkeit: 150% (begrenzt durch Patch)"
1744542250,365,Nun... ich würde es nicht empfehlen.
1744531465,1305,"Formatieren und neu starten, wenn es keinen Cloud-Speicher gibt, um die Errungenschaft abzuschließen
Wir sehen uns auf dem Patch"
1744525212,691,"Ein gut gemachtes Spiel mit mehreren Systemen, die es vom üblichen Reptilienrausch abheben
Zusätzlich zu den grundlegenden Erweiterungen im Hauptteil
kann man mit den während des Spiels gesammelten Ressourcen Runen herstellen und einrichten, und
Knotenpunkteinstellungen, die je nach Charakter unterschiedlich vorgenommen werden müssen, usw.
Frische, weil es sich nicht um ein System handelt, das einfach die Stufe erhöht, um stärker zu werden

Die folgenden Fertigkeiten lösen zusätzliche Fertigkeiten aus, wenn du jede Fertigkeit um 5 oder mehr Stufen erhöhst.
Beispiel) Axt-Wurf 5 Stufen + Dolch-Wurf 5 Stufen = Axt-Wurf 5+Dolch-Wurf 5+Zerschlagen

Leviathan-Axt-Wurf (Kälte, Fernkampf) + Dolch-Wurf (Physisch, Fernkampf)
➡️ Zerschmetternde Leviathan-Axt (Kalt, Physisch, Fernkampf): Die geworfene Axt schleudert einen Dolch aus der Axt.

Flammenaxt (Feuer, Explosion) + Lokis elektrische Vision (Blitz, Fernkampf)
➡️ Elektrische Axt (Feuer, Blitz, Fernkampf, Explosion)

Riesenzahn (Feuer, Nahkampf) + Wirbelhieb (Physisch, Nahkampf)
➡️ Klinge des brennenden Chaos (Feuer, Physisch, Nahkampf, Aura)

Skadis Eisblitz (Kälte, Fernkampf) + Gungnir (Blitz, Fernkampf)
➡️ Odins Eisblitz (Kälte, Blitz, Fernkampf)

Ballista (Physisch, Beschwörung) + Yggdrasils Puls (Blitz, Fernkampf)
➡️ Sturmwut (Blitz, Physisch, Beschwörung, Fernkampf)

Zerschmetternder Boden (Physisch, Nahkampf) + Gletscherbruch (Kälte, Fernkampf)
➡️ Frostfangring (Physisch, Kälte, Nahkampf, Fernkampf)

Fenrirs Klaue (Körperlich, Fernkampf) + Thors Zorn (Blitz, Fernkampf)
➡️ Donnerklaue (Blitz, Körperlich, Fernkampf)

Surt's Flames (Feuer, Fernkampf) + Ice Baptism (Kälte, Nahkampf)
➡️ Höllensturm (Feuer, Kälte, Fernkampf, Beschwörung)"
1744505123,509,"Asgards Fall ist abgestürzt. Ein Absturzbericht wurde an den Entwickler geschickt!
Fehler:
l32 Argument ist undefiniert

Ich habe einen bugähnlichen Fehler beim Zusammenstellen einer Fertigkeitskombination erhalten, was ist das...Entwickler!"
1744450720,555,"Es ist ein lustiges Spiel, das nicht zu leicht und nicht zu schwer ist, aber es gibt ein paar Dinge, die verbessert werden könnten.
Die Objekte auf der Karte sind zu einfach und es gibt nicht viel Abwechslung bei den Builds.
Ich denke, es ist beabsichtigt, verschiedene Attribute durch Kombinationsfähigkeiten zu nutzen, aber es ist einfacher und stärker, Fähigkeiten mit nur einem Attribut zu bauen.
Ich persönlich mag das Knotensystem, mit mehr Updates könnte es also ganz gut werden?"
1744449118,389,"Absturz beim Herstellen einer Kombinationswaffe ändert die Bewertung nicht, bis dies behoben ist"
1744433545,431,"Es ist noch nicht ganz fertig, aber ich denke, es muss noch verbessert werden.

Das Knotensystem ist gut, aber ich wünschte, es könnte überschrieben werden. Es ist ärgerlich, aber ich kann sie nicht abbrechen, löschen oder überschreiben, was verrückt ist.

Außerdem würde ich gerne zusätzlich zu der Kombination von Eigenschaften eine Ein-Bau-Eigenschaft sehen.

Wenn man ein Herpetologe ist, ist es besser, tief zu graben und mehr Vorteile zu erhalten als einen Haufen fragwürdiger Würfel.

Ich weiß nicht, ob die physischen Eigenschaften kombiniert werden können, um eine bessere Waffe zu bauen, aber eine Waffe, die sich mit anderen Eigenschaften stapeln lässt? Es gibt keinen Grund, andere Eigenschaften zu verwenden, die man nicht freischalten muss."
1744424889,142,"Dieses Spiel wurde vom Schöpfer mit einem Kurator verbunden.
Ein Serpentinen-Spiel aus Punkten. Viel Inhalt, aber ein bisschen herausfordernd.

Es ist klar, dass die Entwickler eine Menge Forschung über diese Art von Spiel gemacht haben.
Der automatische Angriff kann ein- und ausgeschaltet werden, es gibt ein einfaches, aber begrenztes Ausweichsystem, Nahkampfangriffe, zufällige Fernkampfangriffe und schadensverursachende Waffen, die sich in die Richtung deines Fortschritts ausdehnen - es ist also klar, dass die Entwickler wissen, was sie tun.

Es ist nur so, dass der Schwierigkeitsgrad ein bisschen hoch ist und es eine Weile dauert, bis man aufsteigt und dauerhafte Ausrüstung bekommt.

Die Feinde werden mit der Zeit immer stärker, und der Spieler kann mit seinem Levelaufstieg oft nicht mithalten. Vor allem, wenn die Feinde in großen Gruppen zusammenkommen. Die Gegner sind zu furchteinflößend, um sich ihnen zu nähern, und wenn man es doch tut, stirbt man schnell, so dass man nichts dagegen tun kann.

Feinde werden im Vergleich zu ihrem Levelaufstieg zu schnell aufgewertet.

Die Grafik besteht aus Pünktchen. Einige Porträts sind illustriert, aber die meisten Objekte bestehen aus Punkten. Die Gesamtauflösung ist nicht sehr hoch, daher gibt es weniger Punkte pro Charakter. Die Charaktere sind eher klein und haben keine klaren Verbündeten oder Feinde.

Das Spiel ist gut durchdacht und hat ein Level-Up-System. Dadurch kann man seine Werte permanent verbessern und durch die auf der Karte verstreuten Buff-Gebäude auch Buffs für die erste Edition erhalten. Zusätzlich zum Aufleveln gibt es ein Knotensystem, bei dem man seine Werte erhöhen kann, je nachdem, was man in den Knoten steckt.

Schließlich gibt es Achievements, und die Spiele dieses Entwicklers sind im Allgemeinen von mittlerem bis fortgeschrittenem Niveau.

Wenn du dich für Serpentine Dot-Spiele interessierst, solltest du sie unbedingt ausprobieren, solange du noch kannst."
1744420289,1309,Lustig lol
1744395486,630,"Die Zeit vergeht wie im Flug und ich möchte meine Speicherdaten auf einen anderen Computer übertragen, aber wie?"
1744378530,1019,"Fehler beim Zusammensetzen von Fertigkeiten, der das Spiel zum Springen bringt"
1744287573,1209,"Zu viele Abstürze...
Das Herstellen von Kombinationswaffen ist schon 2 mal abgestürzt.
Wenn das behoben ist, werde ich die Bewertung noch einmal überarbeiten müssen
----
Absturz ist behoben, aber das Färben ist ein neues Phänomen
Der Inhalt unterscheidet sich aber nicht großartig von der Demo, also wäre es richtig, es nach einem Jahr zu machen."
1744219730,318,"Ich hatte eine Menge Spaß beim Spielen, aber es fehlt immer noch eine Menge Inhalt.
Es wäre ein tolles Spiel, wenn sie es ständig aktualisieren würden."
1744213227,62,"Ich denke, es ist eines der besser gemachten Survivor-Spiele.

Es gibt einen Endgegner in der 10. oder 20. Minute, und man kann ihn entweder töten oder mit den gesammelten Gegenständen besiegen.
Es war ziemlich gut, mit dem Knotensystem etwas Abwechslung zu schaffen.

Außerdem gefällt mir persönlich die Tatsache, dass die Mob-Angriffe lange genug dauern, so dass es nur sehr wenige unvernünftige Tode gibt."
1744208715,811,"Ich weiß, dass sich dieses Spiel schon lange in der Beta-Phase befindet.
aber es scheint, dass viele Dinge fehlen

Die Skill-Balance ist sehr verzerrt
Vor allem die Beschwörungsseite ist ein Level, bei dem man auf eine Mine tritt, wenn man sie wählt.
Darüber hinaus gibt es viele Dinge, bei denen ich mich frage, was für Absichten mit der Fertigkeit verfolgt wurden.
Vor allem Walküre...
Fast alle nützlichen Fertigkeiten sind in physikalischen Eigenschaften enthalten.
Das Netz hat auch gute Synergien wie Coolness auf der physischen Seite.
Vielleicht liegt es daran, dass alle flachen Treffer der Klasse physisch sind.
In diesem Fall hätte die Auslösebedingung ""bei Grundangriff"" lauten müssen.
Auch wenn du sagst, dass du es mischen kannst
ist es in diesem Spiel so, dass Wiederholungswürfe sehr frei sind.
Es gibt also keinen Grund, etwas Schlechtes zu wählen.
Es ist weitaus effizienter, ein einziges Attribut zu wählen.
Sobald du anfängst, mit den Schwierigkeitseinstellungen herumzuspielen, wirst du es schwer haben, außerhalb von
Du hast einen echten Kampf vor dir
Skill-Evolutionen sind auch fragwürdig, wenn sie eine Kombination hätten sein sollen

Das Netz der Seltsamen war anfangs eine Neuheit, und ich mochte es.
Je mehr ich jedoch spielte, desto mehr fielen mir einige Unzulänglichkeiten auf
Es gibt keinen Grund, Verteidigungsattribute zu wählen, außer Schlagkraft und Geschwindigkeit.
Einmal eingesteckt, kann man die Position auch nicht mehr ändern, was nicht sehr praktisch ist.

Auch die Kriegsbemalung ist ein Problem
Wenn man sich den Fertigkeitenbaum ansieht, ist das Konzept für jede Klasse sehr unterschiedlich.
Das Kriegsverbrennungsinventar ist für alle drei Klassen einheitlich.
Man muss jedes Mal alles umdrehen, wenn man die Klasse wechselt.
und die Runen, die man durch Beute erhält, sind nicht klar kategorisiert.
Man muss also mit dem Mauszeiger über eine nach der anderen fahren.
Ich möchte meine Lieblingsrunen in einer separaten Ecke meines Inventars aufbewahren.
aber diese Funktion ist nicht einmal implementiert...
Es ist anstrengend, obendrein noch Tetris zu spielen.

Einige der Tooltips bestehen aufgrund von Übersetzungsfehlern nur aus einem Haufen Zahlen.
Der Hüpf-Bug beim Kombinieren bestimmter Fähigkeiten ist auch nervig...

Ich habe nur die Unzulänglichkeiten aufgezählt, aber es macht Spaß.
Es wäre ein gutes Spiel, wenn man es noch ein wenig optimieren und verbessern würde."
